{
  "schema_version": 1,
  "audit_event_id": "01JZAUDIT0000000000000001",
  "workspace_id": "01JZWORKSPACE0000000000001",
  "request_id": "req-audit-approve",
  "trace_id": "trace-audit-approve",
  "actor_id": "demo-owner",
  "actor_role": "owner",
  "action": "approve_knowledge_object",
  "target_type": "knowledge_object",
  "target_id": "01JZOBJ0000000000000000001",
  "target_ref": "object://knowledge-objects/01JZOBJ0000000000000000001",
  "before_ref": "object://audit-snapshots/knowledge-object-before-1",
  "after_ref": "object://audit-snapshots/knowledge-object-after-1",
  "reason": "人工审核通过低置信知识对象。",
  "payload": {
    "review_status": "approved"
  },
  "created_at": "2026-07-11T03:12:00Z"
}
